Job Title,Company,Location,No. of Openings,Job Level,Salary,Experience,Job URL,Job Description
Guest Relation Supervisor,Bagaichā,"Thirbam Sadak, Baluwatar, Kathmandu",[ 1 ],Senior Level,Not Disclosed,More than or equal to 3 years,https://merojob.com/guest-relation-supervisor/,"Supervise daily operations of the Guest Relations/Front Desk team.Ensure warm, professional, and personalized guest experiences.Handle escalated guest concerns and complaints with efficiency and empathy.Train, mentor, and evaluate Guest Relations Executives to uphold service standards.Coordinate with all departments to meet guest requests seamlessly.Manage VIP arrivals, special occasions, and loyalty program guests.Maintain accurate records of guest preferences and feedback.Prepare daily reports and support the management team with service improvement ideas."
Sales Officer,Bagaichā,"Thirbam Sadak, Baluwatar, Kathmandu",[ 1 ],Mid Level,Not Disclosed,More than or equal to 2 years,https://merojob.com/sales-officer-994/,"Develop and execute strategic sales plans to achieve sales targets and expand the customer base within the hospitality sector.Identify and cultivate relationships with corporate clients, event planners, local businesses, and other potential customers to generate new business opportunities.Maintain and strengthen existing client relationships through regular communication, personalized service, and timely follow-up.Collaborate with the marketing team to develop and implement promotional campaigns, special events, and initiatives to increase restaurant visibility and attract guests.Monitor market trends, competitor activities, and customer feedback to anticipate changes in consumer preferences and adjust sales strategies accordingly.Prepare and present sales forecasts, reports, and performance metrics to management, highlighting achievements, challenges, and areas for improvement.Negotiate contracts, terms, and pricing agreements with clients to ensure profitability while meeting their needs and expectations.Lead, mentor, and motivate the sales team to achieve individual and collective sales goals, providing guidance, support, and ongoing training as needed.Ensure compliance with company policies, procedures, and industry regulations throughout all sales activities."
Administrative Assistant / Rece…,MC Group,"Putalisadak, Kathmandu",[ 2 ],Mid Level,Not Disclosed,More than 3 years,https://merojob.com/administrative-assistant-190/,"Preparing and maintaining standard files of various kinds of documentsHandling phone calls and transferring to the respective personsTyping documents and letters as per the requirement in both Nepali and EnglishGreeting visitors, handling their enquiries, and directing them to the appropriate personsAny additional work given by seniors as and when required"
Accountant,Ghamkheti Guru Company,Kathmandu,[ 1 ],Entry Level,"NRs. 25,000 - 35,000 Monthly",More than or equal to 1 year,https://merojob.com/accountant-3740/,"Record and maintain financial transactionsPrepare monthly, quarterly, and annual financial reportsReconcile bank statements and manage cash flowAssist with budgeting and forecastingEnsure compliance with accounting standards and regulationsSupport audits and financial reviews"
Sales Manager,Ghamkheti Guru Company,Kathmandu,[ 1 ],Senior Level,"NRs. 55,000 - 65,000 Monthly",More than or equal to 5 years,https://merojob.com/sales-manager-582/,"Develop and implement effective sales strategiesLead, train, and motivate the sales team to meet objectivesAnalyze sales data and prepare performance reportsIdentify new business opportunities and client relationshipsCoordinate with finance and operations teams for smooth executionMonitor market trends and competitor activities"
Marketing Manager,Ghamkheti Guru Company,Kathmandu,[ 1 ],Senior Level,"NRs. 55,000 - 65,000 Monthly",More than or equal to 5 years,https://merojob.com/marketing-manager-936/,"Develop and execute integrated marketing strategiesManage online and offline campaigns, promotions, and brandingConduct market research and analyze customer trendsCollaborate with sales and product teams for cohesive strategiesPrepare and manage the marketing budgetEvaluate marketing performance and ROI"
Sales Officer,Panchakanya Group,"Panchakanya Group Corporate Office, Krishnagalli",[ 1 ],Mid Level,Not Disclosed,More than or equal to 2 years,https://merojob.com/sales-officer-995/,Develop and implement effective sales strategies to achieve sales targets for SS Tanks.Achieve sales targets and contribute to the growth of the division.Conduct market research to identify new sales opportunities.Prepare and deliver compelling sales presentations.Provide excellent customer service and after-sales support.Develop and maintain relationships with clients to promote SS tank products.Collaborate with the marketing team for promotional activities.
Assistant Project Manager,Brihat Group,On-site,[ 2 ],Senior Level,Not Disclosed,More than or equal to 5 years,https://merojob.com/assistant-project-manager-23/,"Preparing daily, weekly and monthly progress report (WIP and Sub- contractor Bills).Full time site supervision and Quality control.Lead and manage civil engineering aspects of real estate development projects from conceptualization through completion.Provide technical expertise in site planning, grading, drainage, and infrastructure design.Proficiency in CAD software (e.g., AutoCAD, Civil 3D) and structural analysis tools.Contribute to the development of project budgets by providing accurate and detailed cost estimates for civil engineering components.Strong knowledge of building construction methods and materials with engineering principles, codes, and standards related to civil engineering.Supporting team member to prepare BOQ and schedules using MS project.Frequent coordination with team members.Preferred to locate in any work station within Kathmandu Valley."
Civil Engineer,Brihat Group,On-site,[ 1 ],Mid Level,Not Disclosed,More than or equal to 2 years,https://merojob.com/civil-engineer-700/,"Preparing daily, weekly and monthly progress report (WIP and Sub- contractor Bills).Site supervision and Quality control.Lead and manage civil engineering aspects of real estate development projects from conceptualization through completion.Provide technical expertise in site planning, grading, drainage, and infrastructure designProficiency in CAD software (e.g., AutoCAD, Civil 3D) and structural analysis tools.Contribute to the development of project budgets by providing accurate and detailed cost estimates for civil engineering components.Strong knowledge of building construction methods and materials with engineering principles, codes, and standards related to civil engineering.Prepare BOQ, estimation and schedules independently.Frequent coordination with team membersPreferred to site supervision within Kathmandu valley."
Sales Executive,Entegra Sources,"Baneshwor, Kathmandu",[ 30 ],Mid Level,"NRs. 20,000 - 30,000 Monthly",More than 1 year,https://merojob.com/sales-executive-1178/,"Selected Candidates will carry out, follow up the task provided by their managers, and therefore require good adaptability, quick learning skills and should have attention to detailPrioritize needs in a fast-paced environment and meet tight deadlinesPrepare and organize Sales Report and Presentations prior the month end when requiredMonitor the level of Customer Satisfaction on a regular basisMaintain, assist and endure the efficient Sales Activity plans and conduction"
Sales And Marketing Officer,Green Hill City,Kathmandu,[ 1 ],Mid Level,Not Disclosed,More than or equal to 5 years,https://merojob.com/sales-and-marketing-officer-308/,"Develop and execute marketing strategies to promote properties effectively.Use digital platforms, traditional media, and other marketing tools to increase property visibility.Create appealing and targeted marketing content, including brochures, social media posts, and website listings."
Documentation Officer,Akashi Japanese Language School,"Kathmandu, Nepal.",[ 2 ],Mid Level,Not Disclosed,More than or equal to 2 years,https://merojob.com/documentation-officer-370/,"Responsible for proper storage of the documents, cataloging and retrieving as requiredResponsible for the security of the documents, for assigning access and for removing and destroying obsolete documentsCompetitive market-based salary Outline a long-term storage strategyAdhere to regulatory requirementsWork with colleagues to ensure consistency of documentation practice across the companyTrain employees on efficient documentation usageAssist with both internal and external auditsEnsure documentation integrityControl access to documents"
Accountant / Admin Officer,Three Sixty Ventures,"Sano Thimi, Kathamandu",[ 1 ],Mid Level,"NRs. 22,000 - 30,000 Monthly",More than or equal to 2 years,https://merojob.com/accountant-admin-4/,"Manage and oversee the company's financial transactions and recordsPrepare timely and accurate financial statements and reportsHandle accounts payable, accounts receivable, and bank reconciliationsAssist with budgeting and forecasting activitiesMaintain accurate and organized financial recordsMonitor and track inventory levels and prepare inventory reportsCoordinate with internal departments to ensure timely and accurate payment processingHandle all administrative and clerical duties as neededPrepare and process payroll for employeesEnsure compliance with all financial and tax regulations"
Store Operations Assistant,Dasharath Grocery,"Imadol

                                    ,
                                
                                    Lubhu

                                    ,
                                
                                    Sankhamul

                                    ,
                                
                                    Sanagaun",[ 15 ],Entry Level,Not Disclosed,More than or equal to 1 year,https://merojob.com/store-assistant-44/,"Assist in receiving, storing, and issuing goods.Maintained accurate inventory records and updated stock levels.Organized and arranged products in the store/warehouse.Ensure cleanliness and proper storage conditions.Handle incoming and outgoing stock transactions.Assist customers or staff with product inquiries.Conduct regular stock checks and report discrepancies."
Lower Secondary Level Teacher,Wilson Academy,"Sitapaila, Kathmandu",[ 2 ],Mid Level,Not Disclosed,More than 1 year,https://merojob.com/part-time-teacher-for-lower-secondary-maths-science/,"Teach Mathematics and Science to lower secondary students (Grades 5–7) as per the prescribed curriculum.Prepare and deliver clear, engaging, and well-structured lessons during scheduled hours.Design and conduct formative and summative assessments to monitor student progress.Encourage student participation through interactive activities, experiments, and problem-solving sessions.Provide academic support to students with different learning needs.Maintain accurate records of student performance and attendance.Coordinate with the academic team regarding lesson plans and assessments.Participate in departmental meetings and training programs when required.Prepare students for internal exams and lay a strong foundation for future academic success."
Cashier,Oriental Kitchen,"Baluwatar, Kathmandu",[ 1 ],Entry Level,"NRs. 20,000 - 22,000 Monthly",Not Required,https://merojob.com/cashier-cum-receptionist/,"Must be able to receive & attend guests with courtesy and provide them with information about the restaurant's services and offerings.Process cash, credit, and debit card transactions accurately and efficiently.Maintain a clean and organized cashier/reception area.Answer phone calls, take reservations, and manage customer inquiries.Collaborate with kitchen and waitstaff to ensure smooth operations during peak hours.Resolve customer complaints or concerns in a professional and timely manner.Follow all safety and sanitation protocols to maintain a clean and hygienic environment.Must strictly comply to company policies and procedures regarding cash handling and customer interactions."
Secondary Level Teacher,Wilson Academy,"Sitapaila, Kathmandu",[ 2 ],Mid Level,Not Disclosed,More than or equal to 2 years,https://merojob.com/part-time-teacher-maths-and-science/,"Teach Mathematics and Science to secondary-level students (Grades 9–10) as per the national curriculum.Prepare lesson plans, worksheets, and assessments for both subjects.Deliver engaging and concept-focused lessons during allocated class periods.Clarify complex concepts using examples, experiments, visual aids, and demonstrations where applicable.Provide academic support and remedial instruction to struggling students.Conduct regular evaluations through tests, assignments, and exams.Maintain student records and provide feedback on performance and progress.Coordinate with subject coordinators and participate in academic meetings as needed.Prepare students for board exams like SEE, including model tests and revisions.Uphold classroom discipline and a positive learning environment."
Lower Secondary English Teacher,Wilson Academy,"Sitapaila, Kathmandu",[ 1 ],Mid Level,"NRs. 20,000 - 25,000 Monthly",More than or equal to 2 years,https://merojob.com/lower-secondary-english-teacher-60/,"Implement progressive teaching methods aligned with Wilson Academy's child-centric and holistic development approach, recognizing and accommodating the unique learning styles of each student.Maintain a positive and conducive learning environment by enforcing school rules and disciplinary systems consistently, fostering a culture of respect and responsibility among grade one students.Actively engage in continuous professional development opportunities to enhance teaching skills and stay abreast of changes and developments in educational practices, contributing to personal and career growth within the dynamic educational landscape.Take ownership of the academic progress of a class of primary-age pupils, ensuring effective planning, delivery, and assessment of the curriculum to meet the individual needs of students, fostering an environment that encourages curiosity and critical thinking.Embrace a comprehensive approach to education by promoting not only academic excellence but also actively participating in and facilitating students' involvement in Extracurricular Activities (ECAs), Co-Curricular Activities (CCAs), and life skills development, contributing to the holistic growth of each child."
Lower Secondary Nepali Teacher,Wilson Academy,"Sitapaila, Kathmandu",[ 1 ],Mid Level,"NRs. 20,000 - 25,000 Monthly",More than or equal to 2 years,https://merojob.com/nepali-teacher-lower-secondary-8/,"Teach Nepali language and literature to students of grades 5-7 based on the prescribed curriculum.Prepare lesson plans, teaching materials, and assessments in line with academic standards.Use interactive and student-centered teaching methods to enhance language learning.Encourage reading, writing, speaking, and listening skills through varied activities.Evaluate student progress through classwork, homework, tests, and exams.Provide timely and constructive feedback to students and maintain academic records.Create an inclusive classroom environment that respects diverse backgrounds and learning needs.Organize or support language-related extra-curricular activities like essay competitions, poetry recitations, or drama.Attend staff meetings, training sessions, and school events as required.Communicate effectively with parents/guardians about students' progress and development."
ECA Coordinator,Wilson Academy,"Sitapaila, Kathmandu",[ 1 ],Mid Level,"NRs. 20,000 - 35,000 Monthly",More than or equal to 2 years,https://merojob.com/eca-co-ordinator-11/,"Develop an annual calendar of extra-curricular activities aligned with the school’s goals.Coordinate sports, music, dance, art, drama, debates, clubs, field trips, and other non-academic programs.Encourage student participation and ensure inclusivity for all abilities and interests.Collaborate with teachers, parents, and external partners to organize events and competitions.Ensure all activities are conducted in a safe and structured manner.Maintain records of student participation and achievements.Prepare budget proposals and manage ECA-related expenses.Promote events through school notices, social media, and newsletters.Evaluate the effectiveness of activities and collect feedback for improvement.Support the development of leadership and teamwork skills in students through ECA."
Primary Level Grade Teacher,Wilson Academy,"Sitapaila, Kathmandu",[ 1 ],Mid Level,"NRs. 18,000 - 25,000 Monthly",More than or equal to 2 years,https://merojob.com/primary-level-grade-teacher-36/,"Implement progressive teaching methods aligned with Wilson Academy's child-centric and holistic development approach, recognizing and accommodating the unique learning styles of each student.Maintain a positive and conducive learning environment by enforcing school rules and disciplinary systems consistently, fostering a culture of respect and responsibility among grade one students.Actively engage in continuous professional development opportunities to enhance teaching skills and stay abreast of changes and developments in educational practices, contributing to personal and career growth within the dynamic educational landscape.Take ownership of the academic progress of a class of primary-age pupils, ensuring effective planning, delivery, and assessment of the curriculum to meet the individual needs of students, fostering an environment that encourages curiosity and critical thinking.Embrace a comprehensive approach to education by promoting not only academic excellence but also actively participating in and facilitating students' involvement in Extracurricular Activities (ECAs), Co-Curricular Activities (CCAs), and life skills development, contributing to the holistic growth of each child."
Costing Supervisor / Senior Cos…,Nepal Hydro and Electric Limited,"Butwal, Rupendehi",[ 1 ],Entry Level,Not Disclosed,Not Required,https://merojob.com/costing-supervisor-senior-costing-supervisor/,"Prepare Post job costing, Data analysis and reportingPrepare Variance (Budget Vs Actual) and analytical reportPrepare Invoices as required by divisionsPrepare Sales report."
HR And Admin Officer,Ads Digital,"Durbarmarg, Yak & Yeti Road",[ 1 ],Mid Level,"NRs. 30,000 - 35,000 Monthly",More than or equal to 1 year,https://merojob.com/hr-and-admin-officer-31/,"Organize, maintain and update internal databases with digital personnel records of relevant employee information.Supervise new employee onboarding, prepare offer documentation, and conduct orientation sessions.Keep a track record of leaves such as sick or maternity.Update company policies and FAQ Documents in lieu of Director.First point of contact with employees on HR-related issues and vendors.Ensure legal compliance.Assist payroll department by providing employee information on leaves and employee benefits.Organize a job fair and work on relevant HR projects.Gather staffing needs from the Head of Departments, and create and publish job ads.Schedule job interviews, contact, screen, and shortlist candidates as needed.Administer performance management program by monitoring employee appraisals and salary revisions.Provide guidance on employee behavior and launch investigations.Provide training and development opportunities.Respond to emails and calls on behalf of the department.Take meeting minute notes.Calculate staff entitlements such as annual leaves.Prepare correspondence, arrange meetings, processing confidential reports and documents.Handle all employee queries, written or verbal with the utmost confidentiality.Brings issues to managers’ notice.Keep up to date on current issues and matters related to the HR department.Frequently interact with managers"
MYP Teacher,Himalayan WhiteHouse IB World School,"Subidhanagar, Tinkune-32, Kathmandu",[ 3 ],Mid Level,Not Disclosed,More than or equal to 2 years,https://merojob.com/myp-teacher/,"Develop engaging and challenging curriculum aligned with the IB MYP frameworkPlan and deliver lessons that cater to the diverse needs and learning styles of studentsImplement a holistic and student-centred approach to teaching, fostering creativity and critical thinkingFoster a positive and inclusive classroom environment that promotes inquiry-based learningCollaborate with colleagues to ensure consistency and coherence across the MYP programUtilize a variety of assessment methods to evaluate student progress and provide constructive feedbackCommunicate regularly with students, parents, and guardians to discuss academic progress and address any concernsParticipate in professional development opportunities to enhance teaching skills and stay updated with the IB curriculumContribute to school events and extracurricular activities that support student engagement and well-beingMaintain accurate records of student attendance, grades, and progress reports."
Lead Cybersecurity & DevSecOps …,Tulips Technologies,New Baneshwor,[ 1 ],Senior Level,Not Disclosed,More than or equal to 5 years,https://merojob.com/lead-cybersecurity-devsecops-engineer/,"Lead and manage the security team, ensuring best practices are followed.Develop and enforce security policies, DevSecOps strategy, and risk management plans.Collaborate with development teams to integrate security into the SDLC (Shift-Left Security).Conduct security awareness training for developers and IT staff."
PYP-1 (Art Teacher),Himalayan WhiteHouse IB World School,"Subidhanagar, Tinkune-32, Kathmandu",[ 1 ],Mid Level,Not Disclosed,More than or equal to 2 years,https://merojob.com/pyp-1-art-teacher/,"Delivering high-quality art instruction to students in PYP-1 (ages 6-7) in accordance with the IB curriculum.Developing and implementing engaging lesson plans that foster creativity, critical thinking and self-expression.Encouraging and guiding students to explore different forms of art, techniques and mediums.Providing constructive feedback to students on their work and assist in their personal development.Organizing art exhibitions and competitions to showcase student's work.Collaborating with other teachers to integrate art into the overall curriculum.Maintaining an organized and stimulating classroom environment that promotes learning.Conducting assessments and evaluations to track student progress and identify areas for improvement.Communicating regularly with parents regarding their child's progress and development.Participating in professional development activities and staying updated on current educational trends and best practices in art education."
Pediatric Registrar,Ishan Children and Women's Hospital,"Tokha-5, Basundhara, kathmandu",[ 2 ],Mid Level,Not Disclosed,More than or equal to 1 year,https://merojob.com/pediatric-registrar-9/,"To manage inpatients, outpatients and emergency patients under the supervision of SpecialistsConducting thorough examinations, diagnosing illnesses, Prescribing medications, administering vaccines, Maintaining medical records, and staying updated with advancements in pediatrics.Conduct thorough medical examinations of pediatric patients.Communicate effectively with patients and their families, providing clear explanations of diagnoses and treatment plans.Maintain accurate and up-to-date medical records for all patients.Stay updated on the latest advancements in pediatric medicine.Collaborate with multidisciplinary teams to coordinate patient care.Respond promptly to pediatric emergencies.Contribute to quality improvement initiatives within the department.Adhere to ethical standards and maintain patient confidentiality."
Staff Nurse,Ishan Children and Women's Hospital,"Tokha-5, Basundhara, Kathmandu",[ 4 ],Entry Level,Not Disclosed,Less than 1 year,https://merojob.com/staff-nurse-264/,"Maintaining accurate, complete health care records and reportsAdministering medications to patients and monitoring them for side effects and reactionsPrescribing assistive medical devices and related treatmentsRecording patient vital signs and medical informationOrdering medical diagnostic and clinical testsMonitoring, reporting, and recording symptoms or changes in patient conditionsAssessing, implementing, planning, or evaluating patient nursing care plans by working with healthcare team members"
General Physician (MDGP),Ishan Children and Women's Hospital,"Tokha-5, Basundhara, Kathmandu",[ 2 ],Mid Level,Not Disclosed,More than 2 years,https://merojob.com/general-physician-mdgp/,"Conducting thorough medical assessments, including taking detailed patient histories and performing physical exams.Diagnosing and treating common medical conditions, including respiratory infections, cardiovascular issues, diabetes, and musculoskeletal problems.Ordering and interpreting diagnostic tests, such as blood work, x-rays, and ECGs.Prescribing medications and treatment plans based on patient diagnoses.Providing preventive care and health education to patients, including lifestyle modification and disease prevention strategies.Managing chronic conditions and coordinating care for patients with multiple health issues.Providing emergency medical care as needed.Maintaining accurate, up-to-date medical records for all patients.Collaborating with other medical specialists for the comprehensive care of patients.Participating in continuing education programs and departmental meetings to stay informed on the latest developments in general medicine.Adhering to hospital policies, procedures, and safety protocols."
