Job Title,Company,Location,No. of Openings,Job Level,Salary,Experience,Job URL,Job Description
E-Commerce And Marketing Officer,Healthcare Technologies,"Aspen Marg, St. Xavier's College Road, Maitighar, Kathmandu",[ 1 ],Mid Level,"NRs. 25,000 - 40,000 Monthly",More than 1 year,https://merojob.com/e-commerce-and-marketing-officer/,"Develop and execute e-commerce strategies to boost online sales and market share. Manage and optimize the online store for an excellent user experience.Oversee product listings, pricing, and promotions.Analyze data to identify trends and improve online performance.Plan and implement digital marketing campaigns (SEO/SEM, email, social media). Collaborate on integrated online and offline marketing efforts.Support the development and execution of offline marketing campaigns. Manage the e-commerce budget and track ROI.Stay updated on e-commerce trends and technologies.Report on e-commerce performance to management."
Marketing And Communication Man…,InnoCSR Nepal (Good Bricks System),"Jorpati, Kathmandu",[ 1 ],Senior Level,Not Disclosed,More than or equal to 8 years,https://merojob.com/marketing-and-communications-manager-6/,"Design and implement a comprehensive marketing strategy to promote the Good Bricks System and Good Bricks and enhance brand presence.Design a strategic marketing plan that expands company’s customer base and implement the plan to ensure its strong presence.Lead market research efforts to uncover the viability of existing products/servicesCollaborate with media organizations, advertising agencies, and internal teams to develop innovative campaigns.Coordinate with the sales team and other departments to create and execute effective strategiesMonitor and evaluate ongoing campaigns, ensuring deadlines are met and tasks are completed. Analyze data to evaluate the success of marketing efforts and come up with new ideas to improve brand marketing and exposure"
Area Sales Manager (ASM),BDC Foods,Chitwan and Nearby District Area,[ 1 ],Senior Level,"NRs. 80,000 Monthly",More than or equal to 10 years,https://merojob.com/area-sales-manager-asm-26/,Develop and execute sales strategies to achieve set targets and increase revenue in the designated area.Build and maintain relationships with clients to ensure customer satisfaction and retention.Monitor and analyze market trends and competitor activities to identify new business opportunities.Train and mentor the sales team to improve their performance and achieve sales targets Strong Collaboration with ASO and other sales team.Collaborate with the marketing team to develop promotional activities and campaigns to drive sales.Create sales reports and other required reports  and provide regular updates to the senior management team.Ensure compliance with company policies and procedures.
Sales Manager,Plaza Sales,Kathmandu,[ 1 ],Mid Level,"NRs. 80,000 Monthly",More than 4 years,https://merojob.com/sales-manager-580/,"Develop and execute a strategic sales plan to achieve and exceed wholesale revenue targets.Identify and cultivate relationships with new wholesale buyers.Analyze sales data, identify trends, and develop data-driven strategies to increase wholesale sales volume and profitability.Work closely with the operations and logistics teams to ensure timely order fulfillment and smooth export processes.Manage product returns and resolve customer complaints efficiently"
Accountant,RV Group,"RV GROUP, Bhagwati Bahal, Naxal",[ 2 ],Mid Level,Not Disclosed,More than or equal to 3 years,https://merojob.com/accountant-3733/,"Documents
financial transactions by entering account information.Recommends
financial actions by analyzing accounting options.Summarizes
current financial status by collecting information; preparing balance sheet,
profit and loss statement, and other reports.Substantiates
financial transactions by auditing documents.Maintains
accounting controls by preparing and recommending policies and procedures.Guides accounting
clerical staff by coordinating activities and answering questions.Reconciles
financial discrepancies by collecting and analyzing account information.Secures financial
information by completing database backups.Maintains
financial security by following internal controls.Prepares payments
by verifying documentation, and requesting disbursements.Answers
accounting procedure questions by researching and interpreting accounting
policy and regulations.Complies with
federal, state, and local financial legal requirements by studying existing and
new legislation, enforcing adherence to requirements, and advising management
on needed actions.Prepares special
financial reports by collecting, analyzing, and summarizing account information
and trends.Maintains
customer confidence and protects operations by keeping financial information
confidential."
Accountant,Power Construction Corporation of China,"Kathmandu + UT 1 Project, Mailung Rasuwa",[ 2 ],Mid Level,Not Disclosed,More than or equal to 2 years,https://merojob.com/accountant-3732/,"Manage day-to-day financial transactions and maintain accurate records.Prepare financial statements, reports, and budgets.Handle accounts payable and receivable processes.Reconcile bank statements and ensure all discrepancies are resolved.Assist in preparing tax returns and ensure compliance with tax regulations.Monitor company expenses and assist in cost management.Manage payroll and employee benefits calculations.Perform periodic audits of financial records to ensure accuracy.Collaborate with internal and external auditors.Provide financial insights to support strategic decision-making."
Accountant,N.K Technology,"Kathmandu, Nepal",[ 1 ],Mid Level,Not Disclosed,Less than or equal to 1 year,https://merojob.com/accountant-3731/,"Handle day-to-day accounting transactions and maintain accurate financial records.Generate VAT bills and ensure proper documentation for taxation.Prepare and maintain ledger accounts, journal entries, and reconciliations.Manage accounts payable and receivable, ensuring timely payments and collections.Prepare financial statements, balance sheets, and profit & loss reports.File VAT, TDS, and tax returns as per government regulations.Ensure compliance with tax laws and financial regulations.Coordinate with auditors and assist in internal and external audits.Maintain cash flow records and monitor banking transactions.Work with accounting software (Tally, QuickBooks, or relevant ERP systems)."
Analyst,Audit Partnership,"Anamnagar, Kathmandu",[ 20 ],Entry Level,"NRs. 25,000 Monthly",Not Required,https://merojob.com/analyst-32/,"You will be responsible for your own audits and the detailed analysis of financial data. Reviewing retail promotional activity.With a keen eye for detail, you will be reviewing, evaluating, and investigating datasets to identify discrepancies. You will be given responsibility to make integral decisions and the chance to make a real contribution to the company’s continued success."
Human Resource Assistant,Centrix,"Bansbari Road, Kathmandu",[ 1 ],Mid Level,"NRs. 25,000 Monthly",More than or equal to 1 year,https://merojob.com/human-resource-assistant-16/,"Develop and implement HR policies and proceduresOversee recruitment, onboarding, and employee retentionHandle employee relations, manage attendance and performance evaluation systems.Organize training and development programsMaintain HR records and reports"
Dance Teacher,Rosebud School,"Buddhanagar, Kathmandu",[ 1 ],Mid Level,"NRs. 30,000 - 40,000 Monthly",More than or equal to 2 years,https://merojob.com/dance-teacher-46/,"Teach various styles of dance, such as classical, contemporary, folk, and cultural dances, to students of different age groups.Plan and conduct engaging dance classes that focus on technique, choreography, and performance skills.Develop and implement a comprehensive dance curriculum that aligns with the school's goals and objectives.Create lesson plans, instructional materials, and performance routines for dance classes.Assess students' progress and skill levels through regular evaluations, rehearsals, and performances.Provide constructive feedback and guidance to students to help them improve their dance abilities.Choreograph dance routines and performances for school events, competitions, and showcases.Organize and coordinate dance rehearsals, costume fittings, and stage productions.Collaborate with other dance teachers, school staff, and external instructors to organize workshops, masterclasses, and dance-related events.Participate in faculty meetings and contribute to the overall development of the performing arts program."
Middle School Math Teacher (Gra…,Rosebud School,"Buddhanagar, Kathmandu",[ 1 ],Mid Level,"NRs. 40,000 - 50,000 Monthly",More than or equal to 2 years,https://merojob.com/middle-school-math-teacher-grade-67-8/,"Plan and deliver engaging math lessons based on the curriculum and the students' individual needsUse various instructional techniques and resources to enhance students' understanding and retention of math conceptsCreate and administer assessments to evaluate students' progress and adjust teaching strategies accordinglyCollaborate with colleagues to develop and implement effective and meaningful math programs and activitiesMaintain a positive and inclusive classroom environment, fostering curiosity and critical thinking skillsStay up-to-date with the latest teaching methods and strategies in the field of math educationAdhere to all school policies and procedures, including those related to student safety and confidentiality."
Sales Officer,Plaza Sales,Kathmandu,[ 5 ],Mid Level,"NRs. 30,000 Monthly",More than 2 years,https://merojob.com/sales-officer-980/,"Develop and execute a strategic sales plan to achieve and exceed wholesale revenue targets.Identify and cultivate relationships with new wholesale buyers.Analyze sales data, identify trends, and develop data-driven strategies to increase wholesale sales volume and profitability.Work closely with the operations and logistics teams to ensure timely order fulfillment and smooth export processes.Manage product returns and resolve customer complaints efficientlyWillingness to travel within assigned territory."
Pre School Teacher,Eurokids Gongabu,"Gongabu, Baniyatar",[ 5 ],Mid Level,Not Disclosed,More than 2 years,https://merojob.com/pre-school-teacher-102/,"Plan and implement age-appropriate activities to foster children's physical, social, emotional, and cognitive development.Create a safe and supportive learning environment for children.Develop and implement lesson plans that align with the school's curriculum and educational standards.Utilize a variety of teaching methods to engage children and enhance their learning experience.Monitor and assess students' progress and provide feedback to parents.Collaborate with other teachers and school staff to support the overall development of students.Communicate effectively with parents to provide updates on students' progress and address any concerns.Maintain accurate and organized records of students' academic and behavioral performance.Incorporate technology and other innovative teaching methods to enhance learning."
Primary Level Teacher,Kathmandu Euro IB World School,"Gongabu, Baniyatar, Kathmandu",[ 5 ],Mid Level,Not Disclosed,More than or equal to 2 years,https://merojob.com/primary-level-teacher-64/,"Plan, prepare, and deliver instructional activities that facilitate active learning.Create a positive learning environment that fosters intellectual curiosity, critical thinking, and teamwork.Develop lesson plans and instructional materials aligned with curriculum standards.Assess and document students' progress and provide timely feedback.Collaborate with colleagues, parents, and administrators to support student development.Maintain accurate records of attendance, grades, and behavior.Participate in professional development activities to enhance teaching skills."
Secondary Level Teacher,Kathmandu Euro IB World School,"Gongabu, Baniyatar, Kathmandu",[ 5 ],Mid Level,Not Disclosed,More than 2 years,https://merojob.com/secondary-level-teacher-73/,"Design and implement engaging lesson plans that meet the needs and interests of diverse learners.Utilize various teaching strategies and resources to facilitate student understanding and mastery of subject matter.Assess student learning through quizzes, tests, projects, and other forms of evaluation.Provide constructive feedback to students to support their academic growth.Collaborate with colleagues to develop interdisciplinary units and projects.Communicate regularly with parents/guardians about student progress and concerns.Participate in department meetings, professional development, and school events."
Junior Accountant,Purnaa Enterprises,"Champi, Lalitpur",[ 1 ],Mid Level,"NRs. 32,000 Monthly",More than or equal to 2 years,https://merojob.com/junior-accountant-172/,"Manage petty cash and ensure daily reconciliation of actual cash and the Accounting systemAccurately and on time; purchases, sales, and stock information are entered into the accounting system, and invoices are filed.Track and control payables and receivables.Prepare daily cash and bank balance reconciliation.Handwrite sales and purchase ledgers and VAT billsPrepare monthly VAT Filing TotalsAssist in company end-of-year audit and tax filing process, including getting tax clearance letter (Preparing supporting documents for audit)Work with the Sourcing Team and Production Team to assist in reconciling stock records and the balance sheet stock and WIP values.Assist in preparing VAT Refund detail information – export, import, ACP detailsTrack receipts from customers to assist management of customer advances and receivables and quickly process paperwork for shipment. APC invoice adjustmentsMonthly customer advance report to PMsCheck whether bank balances are sufficient for payments or not and make the transfer to NPR from the USD account if needed.Perform banking-related tasks as required to include depositing or cashing checks, processing payments, obtaining APC, and making international payments.Assist in working with Nepali government offices on behalf of Purnaa including IRD, municipality office, district office, Customs Department, Department of Industry, Immigration, Company Registrar, Labor Office, and others.Cash-incentive filing and processing."
SailPoint Engineer,JiniTeks,"Kathmandu, Nepal",[ 1 ],Mid Level,"NRs. 80,000 Monthly",More than 4 years,https://merojob.com/sailpoint-engineer/,"Design and Implementation: Develop and deploy IAM solutions using SailPoint IIQ and IdentityNow to meet organizational requirements.​Integration: Integrate IAM systems with various applications and platforms, including Okta for single sign-on (SSO) and CyberArk for privileged access management.​Federation Services: Configure and manage PingFederate to enable secure identity federation across different domains.​Access Management: Establish and enforce access policies, ensuring compliance with internal controls and regulatory standards.​Lifecycle Management: Oversee user provisioning, de-provisioning, and role management processes to maintain accurate access rights.​Monitoring and Reporting: Implement monitoring tools and generate reports to assess the effectiveness of IAM solutions and identify areas for improvement.​Collaboration: Work closely with IT security, compliance, and application teams to align IAM strategies with business objectives.​"
Senior Technical Writer,Logpoint Nepal,Lalitpur,[ 1 ],Senior Level,Not Disclosed,More than 4 years,https://merojob.com/senior-technical-writer-3/,"Produce high-quality product documentation for various product lines that help customers understand and use our products. Documentation includes but is not limited to User Guides, Release Notes, Troubleshooting documents and potentially How-to videos. Collaborate with subject matter experts (software developers, quality assurance engineers, project managers, product owners, and other SMEs) to gather technical information to write, update and revise documentation.Help refine our voice, tone, and writing standards.Edit legacy content so it aligns with our user-centric style guide.Conduct peer reviews for grammar, style, and format. Support the Documentation Lead for Roadmap planning and training needs for team members."
Mid QA Engineer (Automation),Aayulogic,"Chakupat, Patan Dhoka",[ 1 ],Mid Level,Not Disclosed,More than 1 year,https://merojob.com/mid-qa-engineer-automation/,"Design, develop, and execute automated test scripts using Selenium.Perform functional, regression, and performance testing.Identify, document, and track bugs using tools like JIRA.Collaborate with developers and product teams to ensure high-quality releases.Ensure compliance with software testing best practices.Work in an Agile environment, participating in sprint planning and review"
Retail Salesperson,Square Feet Store,"Pepsicola, Kathmandu",[ 1 ],Mid Level,"NRs. 25,000 Monthly",More than or equal to 2 years,https://merojob.com/retail-salesperson/,"Greet and assist walk-in customers, understand their needs, and provide product recommendations.Explain product features, benefits, and pricing clearly.Prepare quotations and follow up with clients to close sales.Maintain excellent customer service to encourage repeat business.Coordinate with the delivery team to ensure timely and accurate order fulfillment.Develop and maintain relationships with interior designers, architects, and contractors.Keep a record of visitors, ongoing projects, and key specifiers.Assist in documentation, billing, and handling customer queries.Work closely with the warehouse and logistics team to ensure smooth deliveries.Coordinate with housekeeping and maintenance staff for showroom upkeep."
Office Maintenance Supervisor,East West Concern,Baluwatar,[ 1 ],Mid Level,Not Disclosed,More than 1 year,https://merojob.com/office-maintenance-supervisor/,"Facility Maintenance – Ensuring the office space, equipment, and utilities (HVAC, plumbing, electrical, etc.) are in good working condition.Supervising Maintenance Staff – Managing janitors, handymen, and technicians, assigning tasks, and ensuring work is completed properly.Repairs & Inspections – Conducting routine inspections to identify maintenance needs and coordinating repairs.Safety & Compliance – Ensuring the office complies with safety regulations and company policies (e.g., fire safety, OSHA standards).Vendor & Contractor Coordination – Hiring and supervising external contractors for specialized repairs or upgrades.Inventory Management – Keeping track of tools, supplies, and office maintenance equipment.Budget Management – Managing maintenance costs, requesting quotes, and approving expenses for repairs and upgrades.Emergency Response – Handling urgent maintenance issues like leaks, power outages, or security concerns.Other job as per nature of the job"
Math / Science Teacher,Unique Nepal Academy,"Kathmandu, Nepal",[ 1 ],Mid Level,Not Disclosed,More than 2 years,https://merojob.com/mathsscience-teacher-4/,"Teach Maths and Science subjects to students from Grade 4 to 7.Plan, develop, and implement engaging lesson plans as per the curriculum.Assess students' progress and provide constructive feedback.Maintain a positive and disciplined classroom environment.Collaborate with fellow teachers and school administration to enhance the learning experience.Participate in staff meetings, training programs, and school events."
Basic Level English Language Te…,Unique Nepal Academy,"Kathmandu, Nepal",[ 1 ],Mid Level,Not Disclosed,More than 2 years,https://merojob.com/basic-level-english-language-teacher/,Plan and deliver engaging English language lessons for basic-level students.Develop and implement curriculum plans and instructional materials.Foster a positive and interactive classroom environment.Assess and evaluate students’ progress through assignments and exams.Maintain discipline and classroom management effectively.Collaborate with colleagues and administration for academic development.Encourage students' participation and enhance their language skills.
Teacher,Pathshala Nepal Foundation,"New Baneshwor, Kathmandu",Not found,Not found,Not found,Not found,https://merojob.com/teacher-514/,Not found
Social Media Handler / Content …,Millsberry School,"Bansbari Road, Kathmandu",[ 1 ],Mid Level,Not Disclosed,More than or equal to 1 year,https://merojob.com/social-media-handlercontent-creator/,"Develop creative and informative content for social media platforms including Facebook, Instagram, Twitter, TikTok, You Tube, LinkedIn etc. Plan, schedule, and publish content to ensure consistent online presence Monitor social media activity and respond to comments, messages, and reviews in a timely manner Collaborate with the marketing team to create and implement social media campaigns Use analytics tools to track social media performance and make data-driven decisions Stay updated with current industry trends and incorporate them into content strategy Engage with Millsberry School's online community by creating interactive posts, quizzes, contests etc.Knowledge of professional photography is requiredAssist in creating and managing social media advertisements"
Front Desk Officer,Unique Nepal Academy,"Kathmandu, Nepal",[ 1 ],Mid Level,Not Disclosed,More than 1 year,https://merojob.com/front-desk-officer-1314/,"Greet and assist visitors in a professional and friendly manner.Handle phone calls, emails, and inquiries efficiently.Manage front desk operations, including scheduling and maintaining records.Provide administrative support and coordinate office tasks.Address customer concerns and provide appropriate solutions.Ensure a well-organized and welcoming reception area."
Nepali Language Teacher,Unique Nepal Academy,"Kathmandu, Nepal",[ 1 ],Mid Level,Not Disclosed,More than 2 years,https://merojob.com/nepali-language-teacher-9/,"Teach Nepali language to students from Grade 4 to 7.Plan and develop curriculum, lesson plans, and assessments in alignment with educational standards.Foster a positive and engaging classroom environment to enhance learning.Monitor and evaluate student progress and provide constructive feedback.Maintain classroom discipline and effective classroom management.Work collaboratively with colleagues and school administration for curriculum planning and student support."
Senior .NET Developer (Full Sta…,NBIT,"Balkumari, Lalitpur",[ 2 ],Senior Level,Not Disclosed,More than 8 years,https://merojob.com/senior-net-developer-full-stack/,"Outstanding communication and interpersonal skills.Ability to work well, communicate and contribute to a team and work autonomouslyHas a real passion and interest in learning new technologies and staying up to date.Leadership skillsContribute to the design and architecture of our software and services."
R&D and Delivery Leader,Hitachi Energy,"Kathmandu, Bagmati",[ 1 ],Top Level,Not Disclosed,More than 15 years,https://merojob.com/rd-and-delivery-leader-2/,"Lead, mentor, and motivate a large software development team to achieve high performance.Foster a collaborative and innovative culture that encourages continuous improvement and professional growth.Oversee end-to-end project management, including planning, execution, monitoring, and delivery of software solutions.Develop and manage the budget for the R&D and delivery teams, ensuring efficient allocation of resources.Monitor expenditures, prepare financial forecasts, and provide regular budget reports to senior management.Identify talent needs within the team and oversee recruitment, onboarding, and retention strategies.Conduct regular performance evaluations, provide constructive feedback, and facilitate professional development opportunities.Create and implement succession planning and career development paths for team members.Act as the primary liaison between the offshore team and internal stakeholders, ensuring effective communication and collaboration.Provide regular updates on project status, challenges, and milestones to senior management and relevant stakeholders.Identify potential project risks and develop mitigation strategies to minimize impact.Ensure compliance with industry standards and best practices in software development and project management.Essure the team utilizes global development tools and processes, promoting standardization across projects.Implement and enforce best practices in software development, including coding standards version control and documentation.Establish and maintain global quality assurance processes, including adherence to quality gates and checkpoints throughout the project lifecycle.Ensure comply with industry standards and security protocols, integrating security practices into development process.Living Hitachi Energy’s core values of safety and integrity, which means taking responsibility for your own actions while caring for your colleagues and the business."
