Job Title,Company,Location,No. of Openings,Job Level,Salary,Experience,Job URL,Job Description
Video Creator,ThemeGrill,"Basundhara-3, Kathmandu",[ 2 ],Mid Level,Not Disclosed,More than or equal to 1 year,https://merojob.com/video-creator-7/,"Test and understand our various WordPress plugins and
themes. Write out video scripts, voice over/record those scripts. Edit videos as per the individual’s standard procedure. Examples of a few types of videos: https://youtu.be/jbiBJdowxG0 – Tutorials https://youtu.be/g3rifl7kWvg – Feature videos. https://youtu.be/qnCL_Fs8oxY – Documentation videos"
Accounts And Store Incharge,Mountain Infra Company,"Sankhuwasabha, Kasuwa",[ 1 ],Mid Level,Not Disclosed,More than or equal to 1 year,https://merojob.com/office-engineer-tender/,"Maintain accurate financial records and ensure
     compliance with accounting principles.Handle accounts payable and receivable, including
     invoicing and vendor payments.Prepare financial reports, balance sheets, and profit
     & loss statements.Monitor cash flow, bank transactions, and
     reconciliations."
Receptionist,Nepal Hearing and Speech Clinic,"Thapathali, Kathmandu",[ 1 ],Mid Level,Not Disclosed,More than 1 year,https://merojob.com/receptionist-2096/,"Greet and welcome patients and visitors in a professional and friendly mannerAnswer and direct phone calls to the appropriate department or staff memberSchedule appointments and maintain the clinic's appointment calendarCollect and process patient information and paymentsMaintain and update patient records and filesAssist with administrative tasks such as filing, faxing, and data entryMonitor and order office supplies as neededEnsure the reception area is clean and organized at all timesCollaborate with other staff members to ensure efficient and effective operationsUphold the clinic's confidentiality and privacy policies"
Basic Level Computer Teacher,Texas Int'l Secondary School,"Mitrapark, Chabahil, Kathmandu",[ 1 ],Mid Level,Not Disclosed,More than or equal to 2 years,https://merojob.com/basic-level-computer-teacher-9/,"Plan and deliver well-structured computer science lessons in accordance with the school's curriculum.Utilize a variety of teaching methods to accommodate different learning styles and ensure student understanding.Integrate relevant and up-to-date technology resources into the curriculum to enhance the learning experience.Create and maintain a positive and inclusive classroom environment that encourages student participation and collaboration.Assess and evaluate student progress through assignments, projects, and examinations.Provide constructive feedback to students to support their academic and personal development.Stay current with advancements in technology and incorporate new trends into the curriculum.Collaborate with fellow teachers and school staff to enhance interdisciplinary learning opportunities.Participate in professional development activities to continually enhance teaching skills and knowledge.Foster a love for learning and an appreciation for technology among students."
Computer Operator,Kathmandu Vidya Kunja Secondary School,Tokha,[ 1 ],Entry Level,Not Disclosed,More than 1 year,https://merojob.com/computer-operator-189/,"Maintain computer systems and network.
Input and manage student/staff data.
Provide basic technical support.
Manage school records and documents.
Assist with document preparation and archiving.
Manage equipment inventory."
Mechanical Engineer – Automobile,Mountain Infra Company,Any Place in Nepal,[ 1 ],Mid Level,Not Disclosed,More than or equal to 2 years,https://merojob.com/mechanical-engineer-automobiles/,"Providing
Technical Support for construction, Heavy Duty Vehicles.Leading
Site's WorkshopLeading
the Maintenance and servicing team.Log
Sheet Maintenance, and preparation of Monthly Report.Maintenance
of Equipment Expenses Report.Proper
Record of Vendors Contact Number.Proper
Record of Local Mechanics and Garage Contact Number (Kathmandu).Record
of Equipment operator numbers.Preparing
mechanical purchase order and controlling Inventory."
Customer Moderator,Yodha,"Kathmandu, Nepal",[ 15 ],Entry Level,Not Disclosed,Less than or equal to 1 year,https://merojob.com/customer-moderator-9/,"Translate and interpret written consultations from Roman Nepali to English, and vice versa, ensuring an accurate and precise conveyance of information to the customer.Serve as a liaison between English-speaking customers and Roman Nepali-speaking astrologers, ensuring effective communication and understanding.Create high-quality interpretations of astrological consultations, maintaining a professional and respectful tone.Provide exceptional customer service, addressing inquiries, concerns, and feedback promptly and professionally."
Finance Manager - Manufacturing…,Godawari Business Organization,"Rautahat, Chapur",[ 1 ],Top Level,Not Disclosed,More than 12 years,https://merojob.com/finance-manager-manufacturing-operations-2/,"Supervise and manage daily financial operations
     including budgeting, accounting, and financial reporting.
Ensure accuracy and integrity of financial data and
     timely preparation of financial statements.
Develop and manage annual budgets and financial
     forecasts.
Monitor budget performance and provide
     recommendations for adjustments as needed.
Prepare comprehensive financial reports for the CEO,
     Chairman, and Board of Directors.
Analyze financial data to identify trends,
     variances, and areas for improvement.
Support the development and execution of financial
     strategies that align with the company's strategic goals.
Provide financial insights and recommendations to
     aid in strategic decision-making.
Monitor and control operational costs to enhance
     profitability.
Implement cost-saving initiatives and process
     improvements.
Identify financial risks and develop strategies to
     mitigate them.
Ensure compliance with financial regulations and
     internal controls.
Lead and manage the finance team, ensuring high
     performance and professional development.
Foster a collaborative and productive work
     environment.
Communicate financial performance and strategies
     clearly to the CEO, Chairman, and Board of Directors.
Liaise with external auditors, financial
     institutions, and regulatory bodies as necessary.
Oversee evaluation of investment opportunities and
     financial projects.
Ensure optimal use of company resources to achieve
     financial objectives.
Continuously evaluate and enhance financial
     processes and systems.Implement best practices to improve financial
management and operational efficiency"
Dispatch And Delivery Person,Jay Saibaba Surgical House,"Pepsicola-32, Kathmandu",[ 2 ],Mid Level,Not Disclosed,More than or equal to 2 years,https://merojob.com/logistics-delivery-person-2/,Safely and efficiently operate a 2-wheel vehicle to deliver goods and products to customersPlan and prioritize daily delivery routes to ensure timely and accurate deliveriesLoad and unload goods and products from the vehicleVerify and confirm delivery details with customersCollect payments from customers and maintain accurate recordsCommunicate any delivery delays or issues to the appropriate partiesFollow all safety procedures and traffic laws while drivingMaintain the cleanliness and maintenance of the delivery vehicleDelivering Logistic Management Assist with other warehouse duties as needed
Receptionist,S. Sankalpa Shipping Services,"Kathmandu, Nepal",[ 1 ],Mid Level,Not Disclosed,Less than or equal to 1 year,https://merojob.com/receptionist-2094/,"Greet and assist visitors in a professional manner.Handle incoming calls, emails, and inquiries.Maintain front desk operations and ensure a welcoming environment.Manage appointments and schedule meetings.Assist with basic administrative tasks as required."
Associate Officer - IT,Kathford College of Engineering and Management,"Balkumari, Lalitpur",[ 1 ],Mid Level,Not Disclosed,More than 3 years,https://merojob.com/associate-officer-it/,"Prepare IT department’s plan and supervise the implementation of plan.Provide technical support including Hardware, software and Network for Staffs and Computer Labs across college.Install and configure computer hardware operating systems and applications.Monitor and maintain computer systems and networks. Support to setup of systems or fix systems-related issues.  Device continuous monitoring of IT systems and make periodic maintenance and upgrade plans.Troubleshoot system and network problems, diagnose and solve hardware or software and replace parts as required. Provide support, including procedural documentation and relevant reports.Support the roll-out of new applications as per the need.Conduct electrical safety checks on computers and equipment. Work with vendors to obtain pricing and parts, and perform quality checks of delivered equipment.Maintain inventory of computers and equipment, maintain the warranty, service, and repair record.Maintain the organization’s email system(s)."
Client Service Executive (Night…,B. And B. Soft Tech Kathmandu,Remote,[ 30 ],Entry Level,"NRs. 30,000 Monthly",More than or equal to 1 year,https://merojob.com/client-service-executive-night-shift-29/,"Process applications on behalf of the clients from submission to settlement for our clients in the USACommunicate with other organizations on behalf of the clientProvide excellent customer serviceEnter data with high accuracy, keeping attention to the details dailyMaintain constant communication with supervisorTake additional responsibilities as and when required."
Marketing Intern,S. Sankalpa Shipping Services,"Kathmandu, Nepal",[ 2 ],Entry Level,Not Disclosed,Not Required,https://merojob.com/marketing-intern-85/,Assist in developing and implementing marketing strategies.Conduct market research and analyze trends.Support social media management and content creation.Assist in organizing promotional campaigns and events.Coordinate with the marketing team for day-to-day activities.Prepare reports and presentations on marketing performance.
Program Officer - Alumni And Pu…,Women LEAD Nepal,"Bakhundole, Lalitpur",Not found,Not found,Not found,Not found,https://merojob.com/program-officer-alumni-and-public-engagement/,Not found
Civil Engineer,Realpath Engineering Consultancy,"Gwarko, Kathmandu",[ 1 ],Entry Level,"NRs. 20,000 - 30,000 Monthly",More than or equal to 1 year,https://merojob.com/civil-engineer-699/,"Assist in the planning, design, and execution of Transportation Engineering projectsUtilize ArcGIS and Civil 3D for data analysis and project developmentConduct site visits, surveys, and feasibility studiesPrepare technical reports and drawingsCollaborate with multidisciplinary teams to ensure project success"
Secondary Level Mathematics Tea…,Babylon National School,"Kathmandu, Nepal",[ 2 ],Mid Level,Not Disclosed,More than 2 years,https://merojob.com/secondary-level-mathematics-teacher-17/,"Teach Optional and Compulsory Mathematics to secondary-level students.Develop structured lesson plans aligned with the school curriculum.Create an engaging and student-centered learning environment.Assess and evaluate students through assignments, tests, and exams.Provide academic support to students, including extra classes if needed.Maintain discipline and classroom management as per school guidelines.Collaborate with other teachers for curriculum development and school events.Communicate effectively with parents regarding student progress and performance."
Pre-school Coordinator,Gyan Sanskar International School,Samakhusi Chowk,[ 1 ],Mid Level,Not Disclosed,More than or equal to 2 years,https://merojob.com/pre-school-coordinator-18/,"Plans, organizes and implements the progressive learning curriculum program aligning with organizational mission and visionReview, update, and insure implementation of the curriculum in classrooms to meet required
standards and the individual needs of preschool childrenProvide guidance to teachers and staffs in building skills and competenceEnsure proper implementation of school calendar, daily routine and other day-day-activitiesMonitor and track student progressMaintain relationships with parents and legal guardians of students in order to keep them informed of their child’s progressCollaborate with other teachers in order to share best practices and provide meaningful feedback regularly"
Primary Level Math/Science Teac…,Babylon National School,"Kathmandu, Nepal",[ 3 ],Mid Level,Not Disclosed,More than 1 year,https://merojob.com/primary-level-mathscience-teacher/,"Teach Mathematics and Science to primary-level students in an engaging and interactive manner.Develop lesson plans, instructional materials, and activities that meet the school curriculum.Foster a positive and inclusive learning environment for students.Assess and evaluate students’ progress through assignments, tests, and exams.Encourage student participation and critical thinking in the classroom.Maintain discipline and classroom management following school guidelines.Collaborate with fellow teachers and school staff for curriculum development and extracurricular activities.Communicate effectively with parents and guardians regarding students' progress and concerns."
Primary Level Nepali Teacher,Babylon National School,"Kathmandu, Nepal",[ 1 ],Mid Level,Not Disclosed,More than or equal to 2 years,https://merojob.com/primary-level-nepali-teacher-12/,"Responsible for teaching Nepali subject to primary level studentsMotivate students with enthusiastic, imaginative presentationMaintain discipline in the classroomOrganizing the classroom and learning resources to create a positive learning environmentCommunicates effectively, both orally and in writing, with students, parents, and other professionals on a regular basisKeeping up to date with changes and developments in the structure of the curriculumTaking responsibility for the progress of a classTo ensure that all lessons are planned with clear aims and objectivesPerform other duties as assigned"
Grade Teacher,Babylon National School,"Kathmandu, Nepal",[ 1 ],Mid Level,Not Disclosed,More than 1 year,https://merojob.com/grade-teacher-218/,"Teach and mentor students at the assigned grade level.Develop and implement lesson plans based on the school curriculum.Create an engaging and interactive learning environment.Assess and evaluate students’ academic performance and progress.Maintain discipline and a positive classroom atmosphere.Communicate with parents and guardians regarding students’ progress.Participate in school meetings, training, and extracurricular activities."
Lower Secondary Computer Teacher,Babylon National School,"Kathmandu, Nepal",[ 1 ],Mid Level,Not Disclosed,More than or equal to 2 years,https://merojob.com/computer-teacher-139/,Candidates should teach computer to different gradesPrepare activity based lesson plans and execute accordingly in the classPrepare question papers and submit it to in chargeEquip the students with full knowledge of practical implementation of computer in daily lives Design and develop appropriate computer instructional materialManage and monitor student behaviorDevelop and implement lesson plans and classroom activities inconsistent with the student management issuesCreate lesson plans that are appropriate for the age and abilities of the students in the class
Middle School English Teacher,Brihaspati Vidyasadan,"Naxal, Kathmandu",[ 1 ],Mid Level,Not Disclosed,More than 2 years,https://merojob.com/middle-school-english-teacher-9/,"Including thematic/integrated approaches to organizing teaching-learning activities while fostering creativity while learning.Using art, research, extra reading and a variety of activities into lesson delivery as much as possible.Following up on a variety of learning activities with adequate planning that includes assessment strategies.Encouraging the curiosity and participation of students in all teaching-learning activities.Demonstrating a strong command over the subject matter and its relevance to real life situations. Recording students’ behaviors/skills/strengths/ weaknesses through thorough documentation. Initiating interaction with students – developing a positive relationship with students without appearing biased to anyone while providing accurate, timely, and specific feedback to all.Conducting continuous assessments and preparing standard report cards/observation reports to share with parents.Actively communicating with parents on the progress of their child along with any challenges/achievements they may have experienced."
Front Desk Officer,SK Ventures,Kathmandu,[ 1 ],Mid Level,"NRs. 20,000 - 25,000 Monthly",Equal to 2 years,https://merojob.com/front-desk-officer-1316/,Answer and direct phone calls in a polite and friendly mannerTake messages and communicate to appropriate employees.Greet visitors and escort them to the appropriate office or person as required.Respond to visitor’s questions professionally and courteously.Maintain reception area and all common areas in a clean and tidy manner.Inspecting daily cleaning checklist and ensuring to make it done.Take inventory of stationery supplies and restock as needed.Provide basic and accurate information in-person and via phone/email.Ensure all customer interactions are conducted with a high level of professionalism and service orientation.
Vice Principal,Sathya Sai Shiksha Sadan,"Tokha, Kathmandu",[ 1 ],Senior Level,"NRs. 60,000 - 70,000 Monthly",More than or equal to 5 years,https://merojob.com/vice-principal-119/,"Support the Principal in supervising and coordinating the academic, administrative and co-curricular activities of the school. Oversee curriculum development and design, ensuring alignment with current educational standards.Supervise and mentor teachers, providing support and guidance to enhance their teaching methods and classroom management.Collaborate with the school's administrative team to ensure efficient and effective operations.Plan and coordinate various school events and programs, such as parent-teacher conferences and extracurricular activities.Review and analyze student data to identify areas for improvement and implement necessary interventions.Serve as a liaison between the school, parents, and the community to maintain open communication and foster positive relationships.Conduct regular staff evaluations and provide feedback for continuous growth and improvement.Assist in the recruitment and hiring process for new teachers and staff members.Handle disciplinary issues and provide guidance to students in alignment with the school's policies and values."
Grade Teacher,Sathya Sai Shiksha Sadan,"Tokha, Kathmandu",[ 1 ],Mid Level,"NRs. 25,000 - 35,000 Monthly",More than or equal to 2 years,https://merojob.com/grade-teacher-217/,"Responsible for teaching students in Primary level (Grades 1-3) according to the curriculum guidelines.Plan, prepare and deliver well-structured lessons that engage and motivate students.Implement a variety of teaching methods to accommodate different learning styles and abilities.Use an integrated thematic pedagogy approach to create a dynamic and interactive learning environment.Assess and evaluate student progress through regular assignments, quizzes, and tests.Provide timely feedback to students and parents on academic performance.Collaborate with other teachers and staff to develop and implement school-wide initiatives.Monitor and track student attendance, behavior, and academic progress.Create a positive classroom culture and promote good behavior and discipline.Participate in school events, meetings, and professional development sessions."
Assistant Manager - Finance / A…,Avinash Group,"Chitwan

                                    ,
                                
                                    Kathmandu

                                    ,
                                
                                    Sunsari (Laukahi)",[ 4 ],Senior Level,Not Disclosed,More than or equal to 2 years,https://merojob.com/senior-accountant-503/,"Assist in preparing financial statements, including balance sheets, profit and loss accounts, and cash flow statements.Perform monthly and quarterly financial reconciliationsSupport in the preparation of tax returns and compliance with tax regulationsAssist in audits including reviewing internal controls and processesAnalyze financial data and prepare reports to help in decision makingLiaise with stakeholders, clients and assist in providing financial advice.Manage accounts payable and receivable processes.Assist in preparation of Management reports and budgets.Coordinate with tax, auditors and bank authorities as & when necessary."
Receptionist / Messenger,Modern Cleaning and Servicing,"Uttar Sadak, Balkumari-9, Lalitpur",[ 1 ],Mid Level,Not Disclosed,More than 2 years,https://merojob.com/receptionistmessenger/,"Greet and welcome visitors, clients, and employees in a professional manner.Answer, screen, and forward incoming phone calls and emails.Maintain a tidy and presentable reception area.Schedule appointments, meetings, and conference room bookings.Handle inquiries and provide basic information about the company’s services.Assist in administrative tasks such as data entry, filing, and correspondence.Receive and distribute incoming mail and packages."
Documentation Officers,HRN Group & Management Company,"Bishalnagar

                                    ,
                                
                                    Dhumbarahi

                                    ,
                                
                                    Hadigaun Marga",[ 2 ],Mid Level,"NRs. 25,000 - 30,000 Monthly",More than or equal to 1 year,https://merojob.com/documentation-officers-2/,"Ensure compliance with Japanese regulations for documentation and travel.Prepare, verify, and submit official paperwork.Coordinate with clients, vendors, and internal teams.Provide administrative support (filing, scanning, record-keeping).Communicate with Japanese authorities and consular offices.Maintain document security and confidentiality.Be flexible for travel as needed.Stay updated on regulation changes.Manage documentation for travel, visas, and permits."
Assistant / Customer Service Of…,Amravati,Kathmandu,[ 4 ],Entry Level,Not Disclosed,Not Required,https://merojob.com/assistant-customer-service-officer/,Assistant / Customer Service Officer – AirportAssistant / Customer Service Officer – Air Cargo
Interns,Amravati,"Kathmandu, Nepal",[ 3 ],Entry Level,Not Disclosed,Not Required,https://merojob.com/paid-internship-18/,"Location: Kathmandu, Nepal (with the possibility of transfer as required)Internship Duration: 2 years (Paid)Education: Minimum 12th grade pass (any discipline)Experience: No prior experience required"
Documentation Officer,Skyways Bureau Services,"Kathmandu, Nepal",[ 5 ],Mid Level,"NRs. 17,500 - 30,000 Monthly",More than or equal to 1 year,https://merojob.com/documentation-officer-368/,"Manage and organize company documents, records, and files systematically.Maintain an up-to-date document control system to ensure easy retrieval of information.Handle document classification, storage, and security to protect sensitive information.Ensure compliance with company policies and regulatory requirements for document management.Review and verify the accuracy of documents before processing and filing.Coordinate with different departments to collect, store, and distribute essential records.Assist in preparing reports, presentations, and official documentation.Monitor document expiration dates and ensure timely renewal of legal and contractual documents.Support internal and external audits by providing necessary records and documentation.Perform other administrative duties as assigned."
Computer Science Teacher,Sathya Sai Shiksha Sadan,"Tokha-3, Kathmandu",[ 1 ],Mid Level,"NRs. 25,000 - 35,000 Monthly",More than or equal to 2 years,https://merojob.com/computer-science-teacher-47/,"Develop and implement lesson plans and instructional materials for basic and secondary level studentsTeach computer science concepts and skills, such as programming languages, coding, and algorithms, to studentsIncorporate real-world examples and case studies to illustrate and enhance learning Use a variety of teaching techniques and strategies to engage and motivate students Assess students' progress and provide feedback to help them improve their skills Provide extra help and support to struggling students as needed Collaborate with other subject teachers to integrate computer science concepts into other subject areas Participate in professional development opportunities to stay updated with new technologies and teaching methods Maintain accurate records of students' attendance, grades, and progress Communicate with parents and guardians regularly to discuss their child's progress"
Project Coordinator,Jade Infra,Head Office with frequent project site visits,[ 1 ],Senior Level,Not Disclosed,More than 4 years,https://merojob.com/technical-coordinator-38/,"Provide Technical Support and assistance to Site TeamScheduling meetings, managing documents, and preparing reports for the project manager and stakeholders.Liaison between the project team, stakeholders, and management, ensuring everyone is informed and on the same page.Assist in creating and maintaining project plans, schedules, and budgets, and track progress against milestones.Resource allocation, ensuring the right people and resources are available when needed.They identify potential problems and risks, and work with the project manager to find solutions.They maintain detailed records of project activities, decisions, and progress. Project Scheduling, Planning, Reporting"
