Job Title,Company,Location,No. of Openings,Job Level,Salary,Experience,Job URL,Job Description
Front-End Developer (React.js),Investor Friendly CPA,"Jhamsikel, Lalitpur",[ 2 ],Senior Level,Not Disclosed,More than or equal to 5 years,https://merojob.com/front-end-developer-reactjs-2/,"Develop and maintain scalable, reusable, and efficient front-end components using React.jsCollaborate with UX/UI designers to ensure a seamless and visually appealing user experienceOptimize applications for performance, accessibility, and responsivenessIntegrate RESTful APIs, GraphQL, and third-party servicesWrite clean, modular, and well-documented JavaScript/TypeScript codeTroubleshoot and debug front-end issuesImplement best practices for state management (Redux, Context API, Recoil, Zustand, etc.)Stay up to date with the latest React.js trends and best practicesWork in an Agile/Scrum environment with cross-functional teams"
Python Backend Developer,Investor Friendly CPA,"Jhamsikel, Lalitpur",[ 3 ],Senior Level,Not Disclosed,More than or equal to 5 years,https://merojob.com/python-backend-developer/,"Design, develop, test, and deploy backend services and APIs using Python.Collaborate with frontend developers to integrate user-facing elements with server-side logic.Optimize applications for performance, scalability, and maintainability.Develop and maintain robust and secure databases (e.g., PostgreSQL, MySQL, MongoDB).Implement data pipelines, ETL processes, and integrations with third-party services.Troubleshoot and debug existing applications to improve performance and reliability.Write clean, maintainable, and well-documented code following best practices.Participate in code reviews to ensure code quality and maintain development standards.Stay updated on industry trends, technologies, and best practices in backend development."
Product Manager - Tax Planning …,Investor Friendly CPA,Kathmandu,[ 1 ],Senior Level,"NRs. 100,000 Monthly",More than 5 years,https://merojob.com/product-manager-71/,"Define the product vision and roadmap, with a focus on tax planning functionality, scalability, and AI-driven innovation.Stay updated on industry trends, tax regulations, and competitor offerings to maintain a competitive edge.Align product goals with business objectives and market needs."
Cybersecurity & IT Operations L…,Alaya,Lalitpur,[ 1 ],Mid Level,Not Disclosed,More than 1 year,https://merojob.com/cybersecurity-it-operations-lead/,A strategic thinker with a hands-on mindsetCalm under pressure and energized by solving complex challengesPassionate about cybersecurity trends and continuous improvementFluent in translating tech issues into actionable business insights
School Librarian,Millsberry School,"Bansbari Road, Kathmandu",[ 1 ],Mid Level,"NRs. 25,000 - 40,000 Monthly",More than or equal to 1 year,https://merojob.com/school-librarian-11/,"Manage and maintain the school library’s collection (books, digital resources, materials)Assist students and staff in locating and selecting appropriate reading materialsPromote reading programs, book clubs, and literary eventsEnsure smooth daily operations of the library, including check-outs and returnsMaintain an organized, quiet, and welcoming library environmentSupport students in developing research and information literacy skillsCollaborate with teachers to integrate library resources into the curriculum"
School Nurse,Millsberry School,"Bansbari Road, Kathmandu",[ 1 ],Mid Level,"NRs. 32,000 - 40,000 Monthly",More than or equal to 1 year,https://merojob.com/school-nurse-65/,"Administer first aid and basic healthcare to students and staffMaintain up-to-date student health records and immunization documentationMonitor and manage health-related issues and chronic conditionsPromote health, hygiene, and safety practices in the schoolCommunicate with parents and staff about health concerns or emergenciesCollaborate with school counselors and faculty for holistic student support"
Multi Destination Counsellor,Study Info Centre,New Baneshwor,[ 2 ],Mid Level,"NRs. 80,000 - 100,000 Monthly",More than 3 years,https://merojob.com/multi-destination-counsellor/,Provide professional and quality counselling service that meets/exceeds customers' expectations Achieve the assigned targets by intakesDeliver the pipeline leads and conversion targets by intakeBuild strong customer relationships through genuine guidanceBe 100% compliant with application processesBe a productive and efficient member of the teamEffectively implement global priority projects at the country/office level.
Videographer and Chinese Transl…,Wheel Technology,"Hadigaun, Kathmandu",[ 1 ],Mid Level,"NRs. 55,000 - 80,000 Monthly",More than 1 year,https://merojob.com/videographer-and-chinese-translator/,"Film and produce high-quality video content for various projects.Edit raw video footage into polished, professional videos.Translated written or spoken content from English to Chinese.Collaborate with team members to develop video concepts and storylines.Ensure that all video and translation work meets high standards of accuracy and quality.Maintain and organize video files, footage libraries and translate documents.Operate camera equipment, manage video shoots, and handle translation requests in real-time."
Team Leader – Mortgage Credit A…,Outsourced Experts,Kathmandu,[ 1 ],Senior Level,"NRs. 140,000 - 180,000 Monthly",More than 3 years,https://merojob.com/team-leader-79/,"Lead, mentor, and manage a team of Mortgage Credit Analysts, ensuring optimal performance and productivity.Provide training, coaching, and professional development to enhance team expertise and efficiency.Monitor daily workflows, ensuring timely and accurate loan assessments.Conduct regular performance reviews and implement strategies for continuous improvement."
Digital Marketing Manager,RV Group,"Naxal, Kathmandu",[ 1 ],Senior Level,Not Disclosed,More than 5 years,https://merojob.com/digital-marketing-manager-176/,"Create comprehensive digital marketing plans aligned with business goals.Utilize various digital channels such as SEO, SEM, PPC, social media, email marketing, and content marketing."
Python Developer (Full Stack),Aayulogic,"Chakupat, Patan",[ 1 ],Entry Level,Not Disclosed,More than or equal to 1 year,https://merojob.com/python-developer-full-stack/,"Develop and maintain server-side applications using Python and frameworks like DjangoProven competency building user interfaces using Vue.js or any other JavaScript librariesExperience on RDBMS such as PostgreSQL or similar.Query optimization, database normalization and design skills.Good understanding on building developer-friendly APIs that can be consumed by multiple clients.Brainstorm new features and shape the requirements together with the product owner and stakeholders.Create end-to-end solutions by connecting front-end and back-end components."
Data Analytics Engineer,Aligned Community Care,"On-site, Dhapasi Heights, Kathmandu",Not found,Not found,Not found,Not found,https://merojob.com/data-analytics-engineer/,Not found
Graphic Designer / Video Editor,RV Group,"RV GROUP, Bhagwati Bahal, Naxal",[ 1 ],Mid Level,"NRs. 35,000 - 40,000 Monthly",More than 3 years,https://merojob.com/graphic-designer-cum-video-editor-2/,"Conceptualization and Creation: Develop
and execute creative concepts for motion graphics and video projects,
translating ideas into compelling visuals. Animation and Motion Graphics: Create
animated graphics, including kinetic typography, infographics, and other visual
elements to enhance video content. Video Editing: Edit
raw footage, adding motion graphics, titles, transitions, and other elements to
create a cohesive and impactful narrative. Collaboration: Work
closely with creative teams, clients, and other stakeholders to ensure projects
meet their needs and expectations. Software Proficiency: Utilize
industry-standard software for motion graphics (e.g., Adobe After Effects) and
video editing (e.g., Adobe Premiere Pro, Final Cut Pro). Technical Skills: Possess
skills in areas like rotoscoping, motion/camera tracking, keying, and managing
post-production edits. Audio and Visual Integration: Ensure
that audio elements (music, sound effects, dialogue) are seamlessly integrated
into the video, enhancing the overall experience. Project Management: Manage
multiple projects simultaneously, meeting deadlines and staying
organized. Adaptability: Be
able to adapt to different projects and styles, and to make changes and edits
as needed."
Science Teacher,Ace Higher Secondary School,Kathmandu,[ 1 ],Mid Level,Not Disclosed,Equal to 1 year,https://merojob.com/science-teacher-124/,"Develop and implement technology-enhanced learning methods and resources in the classroom Create a positive and inclusive learning environment for students Use various assessment methods to evaluate students' understanding and progress Communicate with parents and guardians regarding students' academic progress and behavior Attend and participate in school meetings, workshops, and training sessions Keep up-to-date with advancements in Science education, teaching techniques, and technology Establish and maintain classroom rules and expectations Create and maintain a safe and organized classroom environment Mentor and support students in their overall growth and developmentActively participate in and promote the school's individual-centered learning approach Thinking-based learning must be mandatory, and flipped classroom teaching must be used."
Repair Technician,WorldLink Communications,"Lalitpur

                                    ,
                                
                                    Kusunti",[ 2 ],Mid Level,Not Disclosed,More than 3 years,https://merojob.com/repair-technician-2/,"Identify & Troubleshoot issues of Network switches, ONU, STB, remotes, adaptors, wireless devices, Access point, etc.. including its hardware, software, and connectivity problems.Perform component-level repairs on ONU & STB, Network switches, remotes, adaptors,  circuit boards.Replace faulty capacitors, resistors, ICs, transistors, power supply units, LAN ports, and fiber connectors Perform repair, maintenance, and replacement of faulty parts to restore functionality.Configure devices and test them for proper operation, ensuring they meet performance standards. Use diagnostic tools (multimeter, oscilloscope, logic analyzer, etc.) to pinpoint defective components.Maintain accurate records of all repairs, replacements, and configurations performed, including the causes of failure and solutions applied.Work closely with other technical teams and departments to resolve devices issues and ensure customer satisfaction.Conduct regular inspections of repaired mention devices to ensure they meet quality standards before they are returned to  branches/ warehouse or put into service.Monitor and manage parts inventory, ensuring that necessary components are available for repairs.Keep up to date with the latest technologies and trends in mention devices, including firmware updates and software patches."
Principal,Nepal Police Welfare Fund,"Shantipur, Chitwan",Not found,Not found,Not found,Not found,https://merojob.com/principal-143/,Not found
Senior Accountant,Pashupati Kattha Mills,"Dhobighat-3, Ringroad, Lalitpur",[ 1 ],Senior Level,"NRs. 800,000 - 1,000,000 Yearly",More than or equal to 5 years,https://merojob.com/senior-accountant-508/,"Oversee and manage the daily operations of the accounting department including sales and purchase entry, making cash receipt and payment vouchers along with other relevant entries.Vat entry (Maskewari) every month at IRD website. Should be able to prepare statements and documents required for filing VAT Refund.Job related to issuance and collection of Letter of credit, bank guarantee by coordination with the bank.Manage the purchase order, payment to the parties and follow-up on the orders.Coordinate with the national and international parties for procurement of various goods. Machinery items, spare parts and following up with them.Prepare salary sheets and other payment instructions on a daily and monthly basis.Prepare and analyze financial statements, ensuring accuracy and compliance with accounting standardsMonitor and review the company's financial performance and provide insights and recommendations to managementManage the month-end and year-end closing processes, including reconciliations and journal entriesEnsure timely and accurate completion of all tax filings and compliance requirementsCollaborate with other departments to provide financial information and analysis for decision-makingStay updated with changes in accounting regulations and implement necessary changes to ensure complianceParticipate in special projects and initiatives as assigned by management."
HR Adminitrative Assistant,WorldLink Communications,"Bouddha

                                    ,
                                
                                    Satungal",[ 2 ],Entry Level,Not Disclosed,Less than 1 year,https://merojob.com/hr-adminitrative-assistant/,"Responding to internal and external HR related inquiries or requests and provide assistanceRedirecting HR related calls or distribute correspondence to the appropriate person of the teamMaintaining records of personnel-related data in both paper and the database and ensure all employment requirements are metMaintain records of personnel-related data (payroll, personal information, leaves, turnover rates etc.) in both paper and the database and ensure all employment requirements are met.Liaise with other departments or functions (payroll, benefits etc.)Support the recruitment/hiring process by sourcing candidates, performing back ground checks, assisting in shortlisting, issuing employment contracts etc.Assist supervisors in performance management proceduresSchedule meetings, interviews, HR events etc. and maintain the team’s agendaCoordinate training sessions and seminarsPerform orientations, on-boarding and update records with new hiresProduce and submit reports on general HR activityAssist in ad-hoc HR projects, like collection of employee feedbackSupport other functions as assigned."
Sales & Marketing Executive,Executive Search- Merojob,"Sanepa, Lalitpur",[ 1 ],Entry Level,"NRs. 35,000 - 40,000 Monthly",More than or equal to 3 years,https://merojob.com/sales-marketing-executive-184/,"Assist in the development and implementation of sales and marketing strategies to achieve revenue targets.Conduct market research to identify trends, customer needs, and competitor activities.Collaborate with the Sales & Marketing Manager to create engaging marketing materials, including brochures, social media content, and promotional emails.Maintain and update the resort's website and social media profiles to ensure accurate and up-to-date information.Support the organization and execution of promotional events, trade shows, and other marketing activities.Cultivate and maintain positive relationships with clients, travel agencies, and event planners.Respond to inquiries from prospective clients and provide information on resort offerings.Assist in analyzing sales and marketing data to evaluate campaign effectiveness and identify areas for improvement."
Middle School Teacher,Elite Grand School,"Chuchhepati, Mahankal, KMC - 06, Kathmandu, Bagmati, Nepal",[ 12 ],Mid Level,"NRs. 35,000 - 50,000 Monthly",More than 3 years,https://merojob.com/middle-school-teachers-19/,"Plan and deliver interactive lessons as per the school curriculum.Create a stimulating classroom environment that encourages student engagement.Assess and evaluate students' progress through assignments, projects, and tests.Provide individual attention to students needing extra support.Foster creativity, critical thinking, and problem-solving skills in students.Maintain classroom discipline and ensure a safe learning environment.Coordinate with parents, school administration, and fellow teachers for student development.Participate in faculty meetings, workshops, and extracurricular activities."
Store Assistant,Apala Jewels,Baluwatar,[ 1 ],Mid Level,"NRs. 35,000 - 45,000 Monthly",More than 1 year,https://merojob.com/junior-store-assistant-3/,"Act as a secondary host, assisting customers when the primary host is engaged. Support the host with client visits, inquiries, and product presentations."
Junior Advisor,GIZ,Kathmandu,Not found,Not found,Not found,Not found,https://merojob.com/junior-advisor-3/,Not found
Trainee Assistant,Himalayan Everest Insurance,"Karnali Pradesh

                                    ,
                                
                                    Sudurpaschim Pradesh

                                    ,
                                
                                    Bagmati Pradesh

                                    ,
                                
                                    Gandaki Pradesh

                                    ,
                                
                                    Lumbini Pradesh

                                    ,
                                
                                    Madesh Pradesh

                                    ,
                                
                                    Koshi Pradesh",Not found,Not found,Not found,Not found,https://merojob.com/trainee-assistant-93/,Not found
Trainee- Admin & Volunteering 4…,Habitat for Humanity International Nepal,Biratnagar,Not found,Not found,Not found,Not found,https://merojob.com/trainee-admin-volunteering-4-development-v4d/,Not found
Virtual Assistant in Accounts/A…,QPS LTD,Online,Not found,Not found,Not found,Not found,https://merojob.com/virtual-assistant-in-accountsadmin/,Not found
Grade Teacher - English,Euro School Hattigauda,"Euroschool, Hattigauda",[ 1 ],Mid Level,Not Disclosed,More than or equal to 2 years,https://merojob.com/grade-teacher-english-6/,Designing and implementing lesson plans that align with the curriculum and educational standards.Creating a positive and interactive learning environment to foster students' growth and development.Assessing and tracking students' progress and providing constructive feedback.Collaborating with colleagues and parents to ensure a holistic learning experience.Participating in school activities and events.
Middle Level Science Teacher,Euro School Hattigauda,"Euroschool, Hattigauda",[ 1 ],Mid Level,Not Disclosed,More than or equal to 2 years,https://merojob.com/middle-level-science-teacher-2/,"Develop and deliver engaging and interactive science lessons for middle school students, fostering curiosity, critical thinking, and scientific inquiry.Implement the IB MYP Curriculum Frame Work, Science curriculum, ensuring alignment with international standards and best practices in science education.Utilize a variety of instructional strategies, resources, and technology to enhance student learning and facilitate hands-on laboratory experiments and investigations.Differentiate instruction to meet the diverse learning needs and interests of students, including English language learners and students with special needs.Assess student progress through formative and summative assessments, providing timely feedback to students and parents/guardians.Collaborate with colleagues to develop interdisciplinary units of study that integrate science with other subject areas, promoting connections and deeper understanding.Participate in professional development opportunities to stay updated on current trends and research in science education and pedagogy."
Fine Arts Teacher,Euro School Hattigauda,"Euroschool, Hattigauda",[ 1 ],Mid Level,Not Disclosed,More than 1 year,https://merojob.com/fine-arts-teacher/,"Develop and implement engaging Fine Arts curriculum in line with school standards and objectives.Provide instruction in various artistic techniques, including drawing, painting, sculpture, and mixed media.Foster a supportive and inclusive learning environment where students feel encouraged to explore their creativity.Assess student progress and provide constructive feedback to support their artistic development.Collaborate with colleagues to integrate Fine Arts education with other subject areas and school initiatives.Organize and oversee extracurricular activities, such as art clubs or exhibitions, to showcase students' work and talents."
Lower Secondary And Secondary N…,Euro School Hattigauda,"Euroschool, Hattigauda",[ 2 ],Mid Level,Not Disclosed,More than 2 years,https://merojob.com/lower-secondary-and-secondary-nepali-teacher-2/,"Develop and deliver engaging Nepali language lessons tailored to the needs of Lower Secondary and Secondary students.Foster a supportive and inclusive learning environment that promotes cultural appreciation and language proficiency.Incorporate Nepali language instruction into interdisciplinary units, particularly in subjects such as Math’s and  Science.Assess student progress using a variety of assessment tools and provide constructive feedback to support their language acquisition.Collaborate with colleagues to integrate Nepali language and culture across the curriculum.Participate in school events and activities that promote Nepali language and culture within the school community."
Music Teacher (Keyboard And Vio…,Euro School Hattigauda,"Euroschool, Hattigauda",[ 1 ],Mid Level,Not Disclosed,More than or equal to 2 years,https://merojob.com/music-teacher-keyboard-and-violin-and-theatre/,"Plan and deliver engaging co-curricular activities (CCA) in Music and Theatre for students in various grade levels.Develop and implement curriculum and lesson plans that align with the school's educational objectives and promote skill development, creativity, and self-expression.Provide instruction, guidance, and feedback to students to help them develop their talents and achieve their full potential in the respective disciplines.Organize and coordinate rehearsals, performances, showcases, and competitions to showcase students' achievements and foster a culture of excellence.Collaborate with colleagues and school leadership to integrate CCA initiatives into the overall educational program and support interdisciplinary learning opportunities.Maintain accurate records of student attendance, progress, and participation in CCA activities.Participate in professional development opportunities to enhance teaching skills and stay updated on best practices in arts education."
IELTS Instructor,AAEC Global,"Kathmandu, Nepal",[ 2 ],Mid Level,"NRs. 80,000 - 100,000 Monthly",More than 1 year,https://merojob.com/ielts-instructor-145/,"Conduct IELTS preparation classes for students aiming for high band scores.Develop structured lesson plans covering all four modules: Listening, Reading, Writing, and Speaking.Provide individualized feedback and assess student performance through practice tests.Explain IELTS exam structure, question types, and effective strategies for each section.Foster an engaging and supportive classroom environment.Use interactive teaching methods and digital tools to enhance student learning.Stay updated on IELTS format changes and best teaching practices."
Telecaller,AAEC Global,"Kathmandu, Nepal",[ 5 ],Mid Level,"NRs. 17,300 - 20,000 Monthly",More than 1 year,https://merojob.com/telecaller-14/,"Make outbound calls to customers for sales, follow-ups, or inquiries.Handle incoming calls and resolve customer queries in a professional manner.Provide accurate information about products and services.Maintain customer databases and records of calls made.Work towards daily/weekly call and sales targets (if applicable).Assist in customer feedback collection and ensure customer satisfaction.Coordinate with other departments for smooth communication and operations."
Personal Assistant,AAEC Global,"Kathmandu, Nepal",[ 1 ],Mid Level,"NRs. 25,000 - 35,000 Monthly",More than 1 year,https://merojob.com/personal-assistant-51/,"Manage daily schedules, meetings, and travel arrangements for executives.Handle confidential information with professionalism and discretion.Assist in drafting emails, reports, and presentations.Organize and maintain digital and paper filing systems.Coordinate with internal teams and external stakeholders.Perform general office administration tasks as required.Anticipate the needs of the executive and provide proactive support."
Deputy Head of Private Equity,A Capital Market Company,Kathmandu,[ 1 ],Senior Level,Not Disclosed,More than 10 years,https://merojob.com/deputy-head-of-private-equity/,"Lead successful fundraising initiatives within the fundraise period from eligible investors.Maintain consistent communication and coordination with stakeholders for capital calls and fundraising activities.Develop and implement investment policies and strategies aligned with the interests of unit holders.Ensure swift and accurate investment decision-making, including preparation and submission of reports and documentation to senior management and the investment committee.Present investment analyses to the investment committee and support executive negotiations on deal pricing.Finalize documentation prepared by the investment team, verifying the accuracy of valuations and financial models.Collaborate with external consultants for independent due diligence, ensuring outcomes serve the fund's best interests.Build and maintain a strong pipeline of potential deals."
